### ISSUE TITLE
connection on vpn work but no traffic back

### ISSUE THREAD

**Issue by grocanar** [adrienverge/openfortivpn#811]
Hi
on a fedora 33 system i can connect to my vpn 
```
openfortivpn -c /etc/openfortivpn/config
INFO:   Connected to gateway.
Two-factor authentication token: 
INFO:   Authenticated.
INFO:   Remote gateway has allocated a VPN.
Using interface ppp0
Connect: ppp0 <--> /dev/pts/1
INFO:   Got addresses: [172.31.208.27], ns [193.50.0.34, 193.50.0.35]
INFO:   Negotiation complete.
INFO:   Negotiation complete.
local  IP address 172.31.208.27
remote IP address 192.0.2.1
primary   DNS address 193.50.0.34
secondary DNS address 193.50.0.35
INFO:   Interface ppp0 is UP.
INFO:   Setting new routes...
INFO:   Adding VPN nameservers...
INFO:   Tunnel is up and running.
```
I received the routes from my vpn server 
```

Destination     Passerelle      Genmask         Indic   MSS Fenêtre irtt Iface
0.0.0.0         192.168.0.254   0.0.0.0         UG        0 0          0 enp4s0f1
10.0.0.0        0.0.0.0         255.0.0.0       U         0 0          0 ppp0
132.167.194.6   0.0.0.0         255.255.255.255 UH        0 0          0 ppp0
172.16.0.0      0.0.0.0         255.240.0.0     U         0 0          0 ppp0
172.17.0.0      0.0.0.0         255.255.0.0     U         0 0          0 docker0
192.0.2.1       0.0.0.0         255.255.255.255 UH        0 0          0 ppp0
192.168.0.0     0.0.0.0         255.255.255.0   U         0 0          0 enp4s0f1
192.168.0.0     0.0.0.0         255.255.0.0     U         0 0          0 ppp0
192.168.124.0   0.0.0.0         255.255.255.0   U         0 0          0 virbr0
193.50.0.0      0.0.0.0         255.255.255.0   U         0 0          0 ppp0
193.50.1.0      0.0.0.0         255.255.255.0   U         0 0          0 ppp0
193.50.2.0      0.0.0.0         255.255.255.0   U         0 0          0 ppp0
193.50.2.252    192.168.0.254   255.255.255.255 UGH       0 0          0 enp4s0f1
193.50.3.0      0.0.0.0         255.255.255.0   U         0 0          0 ppp0
194.57.241.80   0.0.0.0         255.255.255.248 U         0 0          0 ppp0
195.83.221.0    0.0.0.0         255.255.255.0   U         0 0          0 ppp0
195.83.222.0    0.0.0.0         255.255.255.0   U         0 0          0 ppp0
195.83.223.0    0.0.0.0         255.255.255.0   U         0 0          0 ppp0
195.83.224.0    0.0.0.0         255.255.255.0   U         0 0          0 ppp0
```
but when i ping my remote dns server i got no answer 

but when i tcpdump outside the tunnel i see ther s traffic. my vpn server listen on port 443

```
tcpdump -i enp4s0f1 host vpn.ibfj-evry.fr
dropped privs to tcpdump
tcpdump: verbose output suppressed, use -v or -vv for full protocol decode
listening on enp4s0f1, link-type EN10MB (Ethernet), capture size 262144 bytes
13:03:00.982949 IP grocanar.59988 > vpn.ibfj-evry.fr.https: Flags [P.], seq 2982187072:2982187186, ack 874604832, win 501, options [nop,nop,TS val 74605440 ecr 328273879], length 114
13:03:00.990929 IP vpn.ibfj-evry.fr.https > grocanar.59988: Flags [.], ack 114, win 31, options [nop,nop,TS val 328273968 ecr 74605440], length 0
13:03:01.111088 IP grocanar.59988 > vpn.ibfj-evry.fr.https: Flags [P.], seq 114:228, ack 1, win 501, options [nop,nop,TS val 74605568 ecr 328273968], length 114
13:03:01.119149 IP vpn.ibfj-evry.fr.https > grocanar.59988: Flags [.], ack 228, win 31, options [nop,nop,TS val 328273981 ecr 74605568], length 0

```
but i got nothing inside the tunnel 

```
tcpdump -i ppp0
dropped privs to tcpdump
tcpdump: verbose output suppressed, use -v or -vv for full protocol decode
listening on ppp0, link-type LINUX_SLL (Linux cooked v1), capture size 262144 bytes
13:05:04.886846 IP grocanar > ns2.cng.fr: ICMP echo request, id 1, seq 792, length 64
13:05:05.014731 IP grocanar > ns2.cng.fr: ICMP echo request, id 3, seq 192, length 64

```
how can i debug further? 

the machine was on fedora32 and worked like a charm

**Comment by grocanar** [comment]
The new polocies deniied the ping inside the tunnel. 
then it was not really a problem
the vpn work fine
